"Authors","Author full names","Author(s) ID","Title","Year","Source title","Volume","Issue","Art. No.","Page start","Page end","Page count","Cited by","DOI","Link","Affiliations","Authors with affiliations","Document Type","Publication Stage","Open Access","Source","EID"
"Kumar A.; Kabra G.; Mussada E.K.; Dash M.K.; Rana P.S.","Kumar, Anil (57001679600); Kabra, Gaurav (36470149900); Mussada, Eswara Krishna (56642706900); Dash, Manoj Kumar (57394911300); Rana, Prashant Singh (55533976400)","57001679600; 36470149900; 56642706900; 57394911300; 55533976400","Combined artificial bee colony algorithm and machine learning techniques for prediction of online consumer repurchase intention","2019","Neural Computing and Applications","31","","","877","890","13","25","10.1007/s00521-017-3047-z","https://www.scopus.com/inward/record.uri?eid=2-s2.0-85019745929&doi=10.1007%2fs00521-017-3047-z&partnerID=40&md5=09eb9b4963c97bd321229085ea180056","School of Management, BML Munjal University, Gurgaon, Haryana, India; Department of Operations Management, Xavier Institute of Management, Bhubaneswar, India; School of Engineering and Technology, BML Munjal University, Gurgaon, Haryana, India; Indian Institute of Information Technology and Management, Gwalior, Gwalior, Madhya Pradesh, India; Computer Science and Engineering Department, Thapar University Patiala, Punjab, India","Kumar A., School of Management, BML Munjal University, Gurgaon, Haryana, India; Kabra G., Department of Operations Management, Xavier Institute of Management, Bhubaneswar, India; Mussada E.K., School of Engineering and Technology, BML Munjal University, Gurgaon, Haryana, India; Dash M.K., Indian Institute of Information Technology and Management, Gwalior, Gwalior, Madhya Pradesh, India; Rana P.S., Computer Science and Engineering Department, Thapar University Patiala, Punjab, India","Article","Final","","Scopus","2-s2.0-85019745929"
"Pramod S.L.; Ravikirana; Prasada Rao A.K.; Murty B.S.; Bakshi S.R.","Pramod, S.L. (57189587545); Ravikirana (55988167100); Prasada Rao, A.K. (56962715100); Murty, B.S. (35551753500); Bakshi, Srinivasa R. (24177950800)","57189587545; 55988167100; 56962715100; 35551753500; 24177950800","Microstructure and mechanical properties of as-cast and T6 treated Sc modified A356-5TiB2 in-situ composite","2019","Materials Science and Engineering: A","739","","","383","394","11","24","10.1016/j.msea.2018.10.080","https://www.scopus.com/inward/record.uri?eid=2-s2.0-85055166820&doi=10.1016%2fj.msea.2018.10.080&partnerID=40&md5=77818dd57bea240030f81801a6f7a5bf","Department of Metallurgical and Materials Engineering, Indian Institute of Technology, Chennai, 600036, Madras, India; Department of Physics and Nanotechnology, SRM Research Institute, Chennai, 603203, India; Department of Mechanical Engineering, BML Munjal University, 122413, Haryana, India","Pramod S.L., Department of Metallurgical and Materials Engineering, Indian Institute of Technology, Chennai, 600036, Madras, India; Ravikirana, Department of Physics and Nanotechnology, SRM Research Institute, Chennai, 603203, India; Prasada Rao A.K., Department of Mechanical Engineering, BML Munjal University, 122413, Haryana, India; Murty B.S., Department of Metallurgical and Materials Engineering, Indian Institute of Technology, Chennai, 600036, Madras, India; Bakshi S.R., Department of Metallurgical and Materials Engineering, Indian Institute of Technology, Chennai, 600036, Madras, India","Article","Final","","Scopus","2-s2.0-85055166820"
"Vudadha C.; Parlapalli S.P.; Srinivas M.B.","Vudadha, Chetan (54782042700); Parlapalli, Sai Phaneendra (57194795814); Srinivas, M.B. (9639257700)","54782042700; 57194795814; 9639257700","Energy efficient design of CNFET-based multi-digit ternary adders","2018","Microelectronics Journal","75","","","75","86","11","13","10.1016/j.mejo.2018.02.004","https://www.scopus.com/inward/record.uri?eid=2-s2.0-85044480817&doi=10.1016%2fj.mejo.2018.02.004&partnerID=40&md5=6e59acc780fd3f39856ccd5143f98c7b","BITS-Pilani, Hyderabad Campus, Hyderabad, India; School of Engineering and Technology, BML Munjal University, Gurgoan, India","Vudadha C., BITS-Pilani, Hyderabad Campus, Hyderabad, India; Parlapalli S.P., BITS-Pilani, Hyderabad Campus, Hyderabad, India; Srinivas M.B., School of Engineering and Technology, BML Munjal University, Gurgoan, India","Article","Final","","Scopus","2-s2.0-85044480817"
"Mandal A.K.; Panarotto F.; Cortesi A.; Ferrara P.; Spoto F.","Mandal, Amit Kr (55263686400); Panarotto, Federica (57207633775); Cortesi, Agostino (57211052239); Ferrara, Pietro (24172958700); Spoto, Fausto (6602277589)","55263686400; 57207633775; 57211052239; 24172958700; 6602277589","Static analysis of Android Auto infotainment and on-board diagnostics II apps","2019","Software - Practice and Experience","49","7","","1131","1161","30","24","10.1002/spe.2698","https://www.scopus.com/inward/record.uri?eid=2-s2.0-85066079071&doi=10.1002%2fspe.2698&partnerID=40&md5=762b66baac558590ae0f69a0f6c17ca4","Ca' Foscari University of Venice, Venice, Italy; BML Munjal University, Gurugram, India; University of Verona, Verona, Italy; JuliaSoft Srl, Verona, Italy","Mandal A.K., Ca' Foscari University of Venice, Venice, Italy, BML Munjal University, Gurugram, India; Panarotto F., University of Verona, Verona, Italy; Cortesi A., Ca' Foscari University of Venice, Venice, Italy; Ferrara P., JuliaSoft Srl, Verona, Italy; Spoto F., University of Verona, Verona, Italy","Article","Final","All Open Access; Green Open Access","Scopus","2-s2.0-85066079071"
"Singhal S.; Choudhary S.; Biswal P.C.","Singhal, Shelly (57191825310); Choudhary, Sangita (57205549996); Biswal, Pratap Chandra (57062862700)","57191825310; 57205549996; 57062862700","Return and volatility linkages among International crude oil price, gold price, exchange rate and stock markets: Evidence from Mexico","2019","Resources Policy","60","","","255","261","6","151","10.1016/j.resourpol.2019.01.004","https://www.scopus.com/inward/record.uri?eid=2-s2.0-85060311158&doi=10.1016%2fj.resourpol.2019.01.004&partnerID=40&md5=573bda68cefb676eb8da5c7ed17eaa86","Chitkara Business School Chitkara University, Punjab, India; BML Munjal University, Gurgaon, India; Management Development Institute, Gurgaon, India","Singhal S., Chitkara Business School Chitkara University, Punjab, India; Choudhary S., BML Munjal University, Gurgaon, India; Biswal P.C., Management Development Institute, Gurgaon, India","Article","Final","","Scopus","2-s2.0-85060311158"
"Soni G.; Jain V.; Chan F.T.S.; Niu B.; Prakash S.","Soni, Gunjan (26423256300); Jain, Vipul (35749011500); Chan, Felix T.S. (7202586517); Niu, Ben (8977798100); Prakash, Surya (57226556562)","26423256300; 35749011500; 7202586517; 8977798100; 57226556562","Swarm intelligence approaches in supply chain management: potentials, challenges and future research directions","2019","Supply Chain Management","24","1","","107","123","16","16","10.1108/SCM-02-2018-0070","https://www.scopus.com/inward/record.uri?eid=2-s2.0-85059307906&doi=10.1108%2fSCM-02-2018-0070&partnerID=40&md5=410b48eca51694cb851b3e15c5d21adb","Malaviya National Institute of Technology Jaipur, Jaipur, India; School of Management, Victoria University of Wellington, Wellington, New Zealand; Department of Industrial and Systems Engineering, The Hong Kong Polytechnic University, Hung Hom, Hong Kong; Shenzhen University, Shenzhen, China; BML Munjal University, Gurgaon, India; Arizona State University, Tempe, AZ, United States","Soni G., Malaviya National Institute of Technology Jaipur, Jaipur, India; Jain V., School of Management, Victoria University of Wellington, Wellington, New Zealand; Chan F.T.S., Department of Industrial and Systems Engineering, The Hong Kong Polytechnic University, Hung Hom, Hong Kong; Niu B., Shenzhen University, Shenzhen, China, Arizona State University, Tempe, AZ, United States; Prakash S., BML Munjal University, Gurgaon, India","Review","Final","","Scopus","2-s2.0-85059307906"
"Ahmed J.U.; Ahmed A.; Hoque M.T.; Majid M.A.; Chhikara R.","Ahmed, Jashim Uddin (7102828008); Ahmed, Asma (55448645200); Hoque, Mohammad Tayeenul (57216412191); Majid, Mohammad Abdul (57203042894); Chhikara, Ritu (57219225485)","7102828008; 55448645200; 57216412191; 57203042894; 57219225485","Women entrepreneurs fast food business: a case study on challenging social prejudice through entrepreneurship","2019","Small Enterprise Research","26","3","","307","319","12","2","10.1080/13215906.2019.1671216","https://www.scopus.com/inward/record.uri?eid=2-s2.0-85124836599&doi=10.1080%2f13215906.2019.1671216&partnerID=40&md5=042f2a2b9cfd97b8ffd970372bd9f6a5","Department of Management, School of Business & Economics, North South University, Dhaka, Bangladesh; InterResearch, Dhaka, Bangladesh; Department of Marketing & International Business, School of Business & Economics, North South University, Dhaka, Bangladesh; BML Munjal University, Gurgaon, India","Ahmed J.U., Department of Management, School of Business & Economics, North South University, Dhaka, Bangladesh, InterResearch, Dhaka, Bangladesh; Ahmed A., InterResearch, Dhaka, Bangladesh; Hoque M.T., Department of Marketing & International Business, School of Business & Economics, North South University, Dhaka, Bangladesh; Majid M.A., InterResearch, Dhaka, Bangladesh; Chhikara R., BML Munjal University, Gurgaon, India","Article","Final","","Scopus","2-s2.0-85124836599"
"Hitkul; Aggarwal K.; Yadav N.; Dwivedy M.","Hitkul (57203861190); Aggarwal, Karmanya (58409435200); Yadav, Neha (52365435800); Dwivedy, Maheshwar (32867742100)","57203861190; 58409435200; 52365435800; 32867742100","A comparative study of machine learning algorithms for prior prediction of UFC fights","2019","Advances in Intelligent Systems and Computing","741","","","67","76","9","3","10.1007/978-981-13-0761-4_7","https://www.scopus.com/inward/record.uri?eid=2-s2.0-85053248855&doi=10.1007%2f978-981-13-0761-4_7&partnerID=40&md5=f8d630d894a606982bac2506ddb60bd3","School of Engineering and Technology, BML Munjal University, Gurugram, 122413, Haryana, India","Hitkul, School of Engineering and Technology, BML Munjal University, Gurugram, 122413, Haryana, India; Aggarwal K., School of Engineering and Technology, BML Munjal University, Gurugram, 122413, Haryana, India; Yadav N., School of Engineering and Technology, BML Munjal University, Gurugram, 122413, Haryana, India; Dwivedy M., School of Engineering and Technology, BML Munjal University, Gurugram, 122413, Haryana, India","Conference paper","Final","","Scopus","2-s2.0-85053248855"
"Mussada E.K.; Hua C.C.; Rao A.K.P.","Mussada, Eswara Krishna (56642706900); Hua, Choo Chee (57202331778); Rao, Ayyagari Kameswari Prasada (56962715100)","56642706900; 57202331778; 56962715100","Surface hardenability studies of the die steel machined by WEDM","2018","Materials and Manufacturing Processes","33","16","","1745","1750","5","28","10.1080/10426914.2018.1476695","https://www.scopus.com/inward/record.uri?eid=2-s2.0-85047935914&doi=10.1080%2f10426914.2018.1476695&partnerID=40&md5=6c68a20a62b46fe36caaca7096a9a6a2","Dept. of Mechanical Engineering, SOET, BML Munjal University, Gurgaon, India; Faculty of Manufacturing Engineering, Universiti Malaysia Pahang, Pekan, Malaysia","Mussada E.K., Dept. of Mechanical Engineering, SOET, BML Munjal University, Gurgaon, India; Hua C.C., Faculty of Manufacturing Engineering, Universiti Malaysia Pahang, Pekan, Malaysia; Rao A.K.P., Dept. of Mechanical Engineering, SOET, BML Munjal University, Gurgaon, India, Faculty of Manufacturing Engineering, Universiti Malaysia Pahang, Pekan, Malaysia","Article","Final","","Scopus","2-s2.0-85047935914"
"Momin A.; Sanyal S.","Momin, Abdul (57210176333); Sanyal, Sudip (8455119300)","57210176333; 8455119300","Analysis of Electrodermal Activity Signal Collected during Visual Attention Oriented Tasks","2019","IEEE Access","7","","8751953","88186","88195","9","2","10.1109/ACCESS.2019.2925933","https://www.scopus.com/inward/record.uri?eid=2-s2.0-85069788018&doi=10.1109%2fACCESS.2019.2925933&partnerID=40&md5=e519e0b95d6facb62ed575790e0386d2","Department of Information Technology, Indian Institute of Information Technology Allahabad, Allahabad, 211015, India; Computer Science and Engineering, BML Munjal University, Gurgaon, 122001, India","Momin A., Department of Information Technology, Indian Institute of Information Technology Allahabad, Allahabad, 211015, India; Sanyal S., Computer Science and Engineering, BML Munjal University, Gurgaon, 122001, India","Article","Final","All Open Access; Gold Open Access","Scopus","2-s2.0-85069788018"
"Reddy Y.R.; Varma V.; Cleland J.H.; Bellur U.; Sengupta S.; Sharma N.; Loganathan R.; Sharma R.; Sarkar S.","Reddy, Y. Raghu (55749120700); Varma, Vasudeva (16053729400); Cleland, Jane Huang (6506741859); Bellur, Umesh (15063937300); Sengupta, Shubashsis (57201334615); Sharma, Naveen (57201333802); Loganathan, Ramesh (57189354824); Sharma, Richa (57211128048); Sarkar, Santonu (57190032124)","55749120700; 16053729400; 6506741859; 15063937300; 57201334615; 57201333802; 57189354824; 57211128048; 57190032124","Preface","2018","ACM International Conference Proceeding Series","","","","","","","0","10.1145/3172871.3180078","https://www.scopus.com/inward/record.uri?eid=2-s2.0-85046054727&doi=10.1145%2f3172871.3180078&partnerID=40&md5=f4657dd500d19f5c8fa51412ad4c15d0","IIIT, Hyderabad, India; University of Notradame, United States; IIT Bombay, India; Accenture, India; RIT, New York, United States; Quantiply Corp., United States; BML Munjal University, India; BITS, Pilani, Goa, India","Reddy Y.R., IIIT, Hyderabad, India; Varma V., IIIT, Hyderabad, India; Cleland J.H., University of Notradame, United States; Bellur U., IIT Bombay, India; Sengupta S., Accenture, India; Sharma N., RIT, New York, United States, Quantiply Corp., United States; Loganathan R., IIIT, Hyderabad, India; Sharma R., BML Munjal University, India; Sarkar S., BITS, Pilani, Goa, India","Editorial","Final","","Scopus","2-s2.0-85046054727"
"Das A.; Upadhya P.; Sanyal S.","Das, Anurag (57201102992); Upadhya, Priyank (57207878382); Sanyal, Sudip (8455119300)","57201102992; 57207878382; 8455119300","Optimality of feature selection after dimensionality reduction (latent semantic analysis)","2019","Lecture Notes in Networks and Systems","32","","","271","279","8","2","10.1007/978-981-10-8201-6_31","https://www.scopus.com/inward/record.uri?eid=2-s2.0-85063144200&doi=10.1007%2f978-981-10-8201-6_31&partnerID=40&md5=109fb4e8f21b6ce9d203414b5160664c","IIIT Allahabad, Allahabad, India; BML Munjal University Gurgaon, Gurgaon, India","Das A., IIIT Allahabad, Allahabad, India; Upadhya P., IIIT Allahabad, Allahabad, India; Sanyal S., BML Munjal University Gurgaon, Gurgaon, India","Book chapter","Final","","Scopus","2-s2.0-85063144200"
"Vudadha C.; Rajagopalan S.; Dusi A.; Phaneendra P.S.; Srinivas M.B.","Vudadha, Chetan (54782042700); Rajagopalan, Srinivasan (57200500114); Dusi, Aditya (57200497890); Phaneendra, P. Sai (54785951500); Srinivas, M.B. (9639257700)","54782042700; 57200500114; 57200497890; 54785951500; 9639257700","Encoder-based optimization of CNFET-based ternary logic circuits","2018","IEEE Transactions on Nanotechnology","17","2","","299","310","11","16","10.1109/TNANO.2018.2800015","https://www.scopus.com/inward/record.uri?eid=2-s2.0-85041375970&doi=10.1109%2fTNANO.2018.2800015&partnerID=40&md5=43374daff992ce3ce1ae132836dea560","Department of Electrical and Electronics Engineering, Birla Institute of Technology and Science, Pilani, Hyderabad Campus, Hyderabad, 500078, India; School of Engineering and Technology, BML Munjal University, Gurgaon, 122413, India","Vudadha C., Department of Electrical and Electronics Engineering, Birla Institute of Technology and Science, Pilani, Hyderabad Campus, Hyderabad, 500078, India; Rajagopalan S., Department of Electrical and Electronics Engineering, Birla Institute of Technology and Science, Pilani, Hyderabad Campus, Hyderabad, 500078, India; Dusi A., Department of Electrical and Electronics Engineering, Birla Institute of Technology and Science, Pilani, Hyderabad Campus, Hyderabad, 500078, India; Phaneendra P.S., Department of Electrical and Electronics Engineering, Birla Institute of Technology and Science, Pilani, Hyderabad Campus, Hyderabad, 500078, India; Srinivas M.B., School of Engineering and Technology, BML Munjal University, Gurgaon, 122413, India","Article","Final","","Scopus","2-s2.0-85041375970"
"Agrawal A.; Kumar P.","Agrawal, Anirudh (57199398500); Kumar, Payal (57193952177)","57199398500; 57193952177","Social Entrepreneurship and Sustainable Business Models: The Case of India","2018","Social Entrepreneurship and Sustainable Business Models: The Case of India","","","","1","253","252","3","10.1007/978-3-319-74488-9","https://www.scopus.com/inward/record.uri?eid=2-s2.0-85054119493&doi=10.1007%2f978-3-319-74488-9&partnerID=40&md5=762c98865df207f974914bb617b5c01c","Copenhagen Business School Anirudh Agrawal, Copenhagen, Denmark; Frankfurt, Germany; BML Munjal University, Haryana, India","Agrawal A., Copenhagen Business School Anirudh Agrawal, Copenhagen, Denmark, Frankfurt, Germany; Kumar P., BML Munjal University, Haryana, India","Book","Final","All Open Access; Green Open Access","Scopus","2-s2.0-85054119493"
"Gupta A.; Agarwal S.; Aggarwal G.; Roy S.","Gupta, Archit (57266162300); Agarwal, Siddhartha (56084768100); Aggarwal, Gianeshwar (57212064618); Roy, Sumit (56023717200)","57266162300; 56084768100; 57212064618; 56023717200","Evaluation of emission and performance characteristics of different biodiesel blends with varying FIP on a single cylinder ci engine","2018","2018 2nd IEEE International Conference on Power Electronics, Intelligent Control and Energy Systems, ICPEICES 2018","","","8897342","944","947","3","0","10.1109/ICPEICES.2018.8897342","https://www.scopus.com/inward/record.uri?eid=2-s2.0-85075828470&doi=10.1109%2fICPEICES.2018.8897342&partnerID=40&md5=b874e31363348f46bc3bb6da149eb89d","BML Munjal University, Department of Mechanical Engineering, Gurugram, India","Gupta A., BML Munjal University, Department of Mechanical Engineering, Gurugram, India; Agarwal S., BML Munjal University, Department of Mechanical Engineering, Gurugram, India; Aggarwal G., BML Munjal University, Department of Mechanical Engineering, Gurugram, India; Roy S., BML Munjal University, Department of Mechanical Engineering, Gurugram, India","Conference paper","Final","","Scopus","2-s2.0-85075828470"
"Kumar A.; Mangla S.K.; Luthra S.; Rana N.P.; Dwivedi Y.K.","Kumar, Anil (57001679600); Mangla, Sachin Kumar (55735821600); Luthra, Sunil (43361407000); Rana, Nripendra P. (50262828700); Dwivedi, Yogesh K. (35239818900)","57001679600; 55735821600; 43361407000; 50262828700; 35239818900","Predicting changing pattern: building model for consumer decision making in digital market","2018","Journal of Enterprise Information Management","31","5","","674","703","29","60","10.1108/JEIM-01-2018-0003","https://www.scopus.com/inward/record.uri?eid=2-s2.0-85052711427&doi=10.1108%2fJEIM-01-2018-0003&partnerID=40&md5=1167bf0b65474c0c1790306aff5397b7","BML Munjal University, Gurgaon, India; Department of Mechanical Engineering, Graphic Era University, Dehradun, India; Department of Mechanical Engineering, State Institute of Engineering and Technology, Nilokheri, India; Emerging Markets Research Centre (EMaRC), School of Management, Swansea University, Swansea, United Kingdom","Kumar A., BML Munjal University, Gurgaon, India; Mangla S.K., Department of Mechanical Engineering, Graphic Era University, Dehradun, India; Luthra S., Department of Mechanical Engineering, State Institute of Engineering and Technology, Nilokheri, India; Rana N.P., Emerging Markets Research Centre (EMaRC), School of Management, Swansea University, Swansea, United Kingdom; Dwivedi Y.K., Emerging Markets Research Centre (EMaRC), School of Management, Swansea University, Swansea, United Kingdom","Article","Final","All Open Access; Green Open Access","Scopus","2-s2.0-85052711427"
"Arora N.; Gabrani G.","Arora, Nishtha (57188719533); Gabrani, Goldie (6602608380)","57188719533; 6602608380","Significant Machine Learning and Statistical Concepts and their Applications in Social Computing","2018","ICSCCC 2018 - 1st International Conference on Secure Cyber Computing and Communications","","","8703329","57","61","4","2","10.1109/ICSCCC.2018.8703329","https://www.scopus.com/inward/record.uri?eid=2-s2.0-85065643497&doi=10.1109%2fICSCCC.2018.8703329&partnerID=40&md5=0d4a950bad93db75fb8ab5d4ed90b542","Department of Computer Science, BML Munjal University, Gurugram, India","Arora N., Department of Computer Science, BML Munjal University, Gurugram, India; Gabrani G., Department of Computer Science, BML Munjal University, Gurugram, India","Conference paper","Final","","Scopus","2-s2.0-85065643497"
"Dandanov N.; Samal S.R.; Bandopadhaya S.; Poulkov V.; Tonchev K.; Koleva P.","Dandanov, Nikolay (57191749308); Samal, Soumya Ranjan (57201738477); Bandopadhaya, Shuvabrata (55608418800); Poulkov, Vladimir (24081488100); Tonchev, Krasimir (54421373600); Koleva, Pavlina (24824677600)","57191749308; 57201738477; 55608418800; 24081488100; 54421373600; 24824677600","Comparison of Wireless Channels for Antenna Tilt Based Coverage and Capacity Optimization","2018","6th Global Wireless Summit, GWS 2018","","","8686597","119","123","4","4","10.1109/GWS.2018.8686597","https://www.scopus.com/inward/record.uri?eid=2-s2.0-85064733833&doi=10.1109%2fGWS.2018.8686597&partnerID=40&md5=67b275a48dec1fd4dd67a548ff2a5d8f","Faculty of Telecommunications, Technical University of Sofia, Sofia, Bulgaria; BML Munjal University, Gurgaon, India","Dandanov N., Faculty of Telecommunications, Technical University of Sofia, Sofia, Bulgaria; Samal S.R., Faculty of Telecommunications, Technical University of Sofia, Sofia, Bulgaria; Bandopadhaya S., BML Munjal University, Gurgaon, India; Poulkov V., Faculty of Telecommunications, Technical University of Sofia, Sofia, Bulgaria; Tonchev K., Faculty of Telecommunications, Technical University of Sofia, Sofia, Bulgaria; Koleva P., Faculty of Telecommunications, Technical University of Sofia, Sofia, Bulgaria","Conference paper","Final","","Scopus","2-s2.0-85064733833"
"Bharath M.; Reddy K.V.; Dey R.","Bharath, Malapati (57210344120); Reddy, Karri Vivek (57215296198); Dey, Rajiv (57192542474)","57210344120; 57215296198; 57192542474","Implementation of IoT architecture for intruder alert system using MQTT protocol and MEAN stack","2018","2018 4th International Conference on Computing Communication and Automation, ICCCA 2018","","","8777526","","","","1","10.1109/CCAA.2018.8777526","https://www.scopus.com/inward/record.uri?eid=2-s2.0-85070350573&doi=10.1109%2fCCAA.2018.8777526&partnerID=40&md5=dff857e940a1af4902c346a9a428e37f","Electronics and Communication Engineeering Department, BML Munjal University, Gurgaon, India","Bharath M., Electronics and Communication Engineeering Department, BML Munjal University, Gurgaon, India; Reddy K.V., Electronics and Communication Engineeering Department, BML Munjal University, Gurgaon, India; Dey R., Electronics and Communication Engineeering Department, BML Munjal University, Gurgaon, India","Conference paper","Final","","Scopus","2-s2.0-85070350573"
"Tyagi M.; Hulyalkar H.; Kothari H.; Kapoor A.; Bhatia A.; Vij A.","Tyagi, Mrinal (57201954367); Hulyalkar, Hrishikesh (57201953710); Kothari, Harshvardhan (57201952833); Kapoor, Amrita (57201953121); Bhatia, Aishwarya (57201952178); Vij, Alisha (57201952117)","57201954367; 57201953710; 57201952833; 57201953121; 57201952178; 57201952117","Service innovation and its consequences: The growing imperative of knowledge sharing and donating on quality of service innovation techniques","2018","Harnessing Human Capital Analytics for Competitive Advantage","","","","113","120","7","0","10.4018/978-1-5225-4038-0.ch005","https://www.scopus.com/inward/record.uri?eid=2-s2.0-85046563170&doi=10.4018%2f978-1-5225-4038-0.ch005&partnerID=40&md5=8dc20d60c7874c0837f229b53bd4884f","BML Munjal University, India","Tyagi M., BML Munjal University, India; Hulyalkar H., BML Munjal University, India; Kothari H., BML Munjal University, India; Kapoor A., BML Munjal University, India; Bhatia A., BML Munjal University, India; Vij A., BML Munjal University, India","Book chapter","Final","","Scopus","2-s2.0-85046563170"
"Paul R.; Ponnam A.","Paul, Rik (55181784800); Ponnam, Abhilash (37077915600)","55181784800; 37077915600","Teaching Customer Experience Quality and its Significance in Retail Management: A Role Playing Game using Chinese Puzzle ‘Tangram’","2018","Decision Sciences Journal of Innovative Education","16","2","","126","139","13","8","10.1111/dsji.12147","https://www.scopus.com/inward/record.uri?eid=2-s2.0-85044281205&doi=10.1111%2fdsji.12147&partnerID=40&md5=fe7e15ec492e130da63f82a212fa045b","School of Management, BML Munjal University, Gurgaon, Haryana, India; Department of Business Analytics, School of Business Management, Narsee Monjee Institute of Management Studies (NMIMS), Hyderabad, Telengana, India","Paul R., School of Management, BML Munjal University, Gurgaon, Haryana, India; Ponnam A., Department of Business Analytics, School of Business Management, Narsee Monjee Institute of Management Studies (NMIMS), Hyderabad, Telengana, India","Article","Final","","Scopus","2-s2.0-85044281205"
