"Authors","Author full names","Author(s) ID","Title","Year","Source title","Volume","Issue","Art. No.","Page start","Page end","Page count","Cited by","DOI","Link","Affiliations","Authors with affiliations","Document Type","Publication Stage","Open Access","Source","EID"
"Thakran M.; Kumar S.; Phogat R.; Ray S.K.; Brajpuriya R.; Singh Rana A.; Kumar B.","Thakran, Mamta (57230170700); Kumar, Sumeet (57213856684); Phogat, Rohit (57230563100); Ray, S.K. (57659740300); Brajpuriya, R. (10240242800); Singh Rana, Abhimanyu (57254091100); Kumar, Brijesh (55435104600)","57230170700; 57213856684; 57230563100; 57659740300; 10240242800; 57254091100; 55435104600","Synthesis of nanocrystalline reduced graphene oxide quantum dots","2021","International Journal of Nanoscience","20","4","2150036","","","","1","10.1142/S0219581X21500368","https://www.scopus.com/inward/record.uri?eid=2-s2.0-85114665268&doi=10.1142%2fS0219581X21500368&partnerID=40&md5=ea344bc56a4ba4cb925ea6bb93f0b7bf","Centre for Nano Science and Technology, Amity Institute of Nanotechnology, Amity University, Haryana, India; Centre for Stem Cell, Amity Institute of Bio-Technology, Amity University, Haryana, India; Department of Physics, School of Engineering, University of Petroleum and Energy Studies, Dehradun, India; BML Munjal University, Haryana, Gurugram, India; Amity School of Engineering and Technology, Amity University, Haryana, India; Amity Institute of Laser Technology and Optoelectronics, Amity University, Haryana, India","Thakran M., Centre for Nano Science and Technology, Amity Institute of Nanotechnology, Amity University, Haryana, India; Kumar S., Centre for Nano Science and Technology, Amity Institute of Nanotechnology, Amity University, Haryana, India; Phogat R., Centre for Nano Science and Technology, Amity Institute of Nanotechnology, Amity University, Haryana, India; Ray S.K., Centre for Stem Cell, Amity Institute of Bio-Technology, Amity University, Haryana, India; Brajpuriya R., Department of Physics, School of Engineering, University of Petroleum and Energy Studies, Dehradun, India; Singh Rana A., BML Munjal University, Haryana, Gurugram, India; Kumar B., Centre for Nano Science and Technology, Amity Institute of Nanotechnology, Amity University, Haryana, India, Amity School of Engineering and Technology, Amity University, Haryana, India, Amity Institute of Laser Technology and Optoelectronics, Amity University, Haryana, India","Article","Final","","Scopus","2-s2.0-85114665268"
"Goswami T.; Bheemaraju A.; Sharma A.K.; Bhandari S.","Goswami, Tapas (26635238800); Bheemaraju, Amarnath (54392380300); Sharma, Amit Kumar (55605770459); Bhandari, Sahil (57220717585)","26635238800; 54392380300; 55605770459; 57220717585","Perylenetetracarboxylic acid–incorporated silver nanocluster for cost-effective visible-light-driven photocatalysis and catalytic reduction","2021","Colloid and Polymer Science","299","6","","925","936","11","5","10.1007/s00396-021-04813-w","https://www.scopus.com/inward/record.uri?eid=2-s2.0-85099805560&doi=10.1007%2fs00396-021-04813-w&partnerID=40&md5=9e4f12b1b83655da4ea2ea55da074667","Department of Chemistry, School of Engineering Sciences, University of Petroleum & Energy Studies (UPES), Energy Acres Building, Dehradun, 248007, Uttarakhand, India; Department of Applied Sciences, School of Engineering and Technology, BML Munjal University, Sidhrawali, Gurgaon, 122413, Haryana, India; CSIR—Indian Institute of Petroleum, Haridwar Road, Mohkampur, Dehradun, 248005, India","Goswami T., Department of Chemistry, School of Engineering Sciences, University of Petroleum & Energy Studies (UPES), Energy Acres Building, Dehradun, 248007, Uttarakhand, India; Bheemaraju A., Department of Applied Sciences, School of Engineering and Technology, BML Munjal University, Sidhrawali, Gurgaon, 122413, Haryana, India; Sharma A.K., Department of Chemistry, School of Engineering Sciences, University of Petroleum & Energy Studies (UPES), Energy Acres Building, Dehradun, 248007, Uttarakhand, India; Bhandari S., CSIR—Indian Institute of Petroleum, Haridwar Road, Mohkampur, Dehradun, 248005, India","Article","Final","","Scopus","2-s2.0-85099805560"
"Thakran M.; Kumar S.; Phogat R.; Ray S.K.; Brajpuriya R.; Rana A.S.; Kumar B.","Thakran, Mamta (57230170700); Kumar, Sumeet (57213856684); Phogat, Rohit (57230563100); Ray, S.K. (57659740300); Brajpuriya, R. (10240242800); Rana, Abhimanyu Singh (36182549900); Kumar, Brijesh (55435104600)","57230170700; 57213856684; 57230563100; 57659740300; 10240242800; 36182549900; 55435104600","High Pressure Growth Approach for the Preparation of Reduced Graphene Oxide and its Investigation Using Raman Spectroscopy; [Метод вирощування при високому тиску для одержання відновленого оксиду графену і його дослідження за допомогою Раманівської спектроскопії]","2021","Journal of Nano- and Electronic Physics","13","4","","1","5","4","3","10.21272/jnep.13(4).04015","https://www.scopus.com/inward/record.uri?eid=2-s2.0-85113355405&doi=10.21272%2fjnep.13%284%29.04015&partnerID=40&md5=5fc8a067d39e6865d721b205f33932a3","Centre for Nano Science & Technology, Amity Institute of Nanotechnology, Amity University, Haryana, India; Centre for Stem Cell, Amity Institute of Biotechnology, Amity University, Haryana, India; University of Petroleum and Energy Studies, Department of Physics, School of Engineering, Dehradun, India; BML Munjal University, Gurugram, Haryana, India; Amity School of Engineering & Technology, Amity University, Haryana, India; Amity Institute of Laser Technology & Optoelectronics, Amity University, Haryana, India","Thakran M., Centre for Nano Science & Technology, Amity Institute of Nanotechnology, Amity University, Haryana, India; Kumar S., Centre for Nano Science & Technology, Amity Institute of Nanotechnology, Amity University, Haryana, India; Phogat R., Centre for Nano Science & Technology, Amity Institute of Nanotechnology, Amity University, Haryana, India; Ray S.K., Centre for Stem Cell, Amity Institute of Biotechnology, Amity University, Haryana, India; Brajpuriya R., University of Petroleum and Energy Studies, Department of Physics, School of Engineering, Dehradun, India; Rana A.S., BML Munjal University, Gurugram, Haryana, India; Kumar B., Centre for Nano Science & Technology, Amity Institute of Nanotechnology, Amity University, Haryana, India, Amity School of Engineering & Technology, Amity University, Haryana, India, Amity Institute of Laser Technology & Optoelectronics, Amity University, Haryana, India","Article","Final","All Open Access; Green Open Access","Scopus","2-s2.0-85113355405"
"Phutela N.; Relan D.; Gabrani G.; Kumaraguru P.","Phutela, Nishtha (57193687658); Relan, Devanjali (55662038700); Gabrani, Goldie (6602608380); Kumaraguru, Ponnurangam (14042000100)","57193687658; 55662038700; 6602608380; 14042000100","EEG Based Stress Classification in Response to Stress Stimulus","2022","Communications in Computer and Information Science","1546 CCIS","","","354","362","8","1","10.1007/978-3-030-95711-7_30","https://www.scopus.com/inward/record.uri?eid=2-s2.0-85124673504&doi=10.1007%2f978-3-030-95711-7_30&partnerID=40&md5=a9c095a37da0eaf5fa689b25d35ad64e","Computer Science and Engineering Department, BML Munjal University, Haryana, Gurugram, India; College of Engineering, Vivekananda Institute of Professional Studies, Pitampura, New Delhi, India; Computer Science Department, IIIT Hyderabad, Hyderabad, Gachibowli, India","Phutela N., Computer Science and Engineering Department, BML Munjal University, Haryana, Gurugram, India; Relan D., Computer Science and Engineering Department, BML Munjal University, Haryana, Gurugram, India; Gabrani G., College of Engineering, Vivekananda Institute of Professional Studies, Pitampura, New Delhi, India; Kumaraguru P., Computer Science Department, IIIT Hyderabad, Hyderabad, Gachibowli, India","Conference paper","Final","","Scopus","2-s2.0-85124673504"
"Rasheed T.; Kargeti A.; Siddiqui S.A.","Rasheed, Tabish (57207562016); Kargeti, Ankit (57212392406); Siddiqui, Shamoon Ahmad (7102113421)","57207562016; 57212392406; 7102113421","Design of two novel dyes having maximum absorption in infrared region: A DFT investigation","2022","Materials Today: Proceedings","68","","","2715","2719","4","0","10.1016/j.matpr.2022.06.267","https://www.scopus.com/inward/record.uri?eid=2-s2.0-85134359592&doi=10.1016%2fj.matpr.2022.06.267&partnerID=40&md5=0f5ba9e4af62e09833d164c1b9f3bb8c","School of Engineering and Technology, BML Munjal University, Haryana, Gurugram, 122413, India; Promising Centre for Sensors and Electronic Devices, Najran University, Najran, 11001, Saudi Arabia; Department of Physics, Najran University, Najran, 11001, Saudi Arabia","Rasheed T., School of Engineering and Technology, BML Munjal University, Haryana, Gurugram, 122413, India; Kargeti A., School of Engineering and Technology, BML Munjal University, Haryana, Gurugram, 122413, India; Siddiqui S.A., Promising Centre for Sensors and Electronic Devices, Najran University, Najran, 11001, Saudi Arabia, Department of Physics, Najran University, Najran, 11001, Saudi Arabia","Article","Final","","Scopus","2-s2.0-85134359592"
"Kuchana M.; Srivastava A.; Das R.; Mathew J.; Mishra A.; Khatter K.","Kuchana, Maheshwar (57219930711); Srivastava, Amritesh (57219928980); Das, Ronald (57219925087); Mathew, Justin (57219929777); Mishra, Atul (57214672356); Khatter, Kiran (54787827500)","57219930711; 57219928980; 57219925087; 57219929777; 57214672356; 54787827500","AI aiding in diagnosing, tracking recovery of COVID-19 using deep learning on Chest CT scans","2021","Multimedia Tools and Applications","80","6","","9161","9175","14","21","10.1007/s11042-020-10010-8","https://www.scopus.com/inward/record.uri?eid=2-s2.0-85096100134&doi=10.1007%2fs11042-020-10010-8&partnerID=40&md5=3dcce0c16c0647f59673dd0484a6c534","BML Munjal University, Kapriwas, India; IIT, Delhi, New Delhi, India; MAHE MIT University, Manipal, India; RayEye, Bengaluru, India","Kuchana M., BML Munjal University, Kapriwas, India; Srivastava A., IIT, Delhi, New Delhi, India; Das R., MAHE MIT University, Manipal, India; Mathew J., RayEye, Bengaluru, India; Mishra A., BML Munjal University, Kapriwas, India; Khatter K., BML Munjal University, Kapriwas, India","Article","Final","All Open Access; Bronze Open Access; Green Open Access","Scopus","2-s2.0-85096100134"
"Chauhan R.; Bandopadhaya S.; Dev M.; Mishra A.; Giri L.I.; Kharel B.; Samal S.R.","Chauhan, Rishabh (57550161200); Bandopadhaya, S. (55608418800); Dev, Mayank (55819919200); Mishra, A. (56347808500); Giri, Lalat Indu (55900766900); Kharel, Biplap (57559060300); Samal, Soumya Ranjan (57201738477)","57550161200; 55608418800; 55819919200; 56347808500; 55900766900; 57559060300; 57201738477","Design of Robotic Snake with ESP 32 CAM and Arduino","2021","Proceedings - 2021 19th OITS International Conference on Information Technology, OCIT 2021","","","","6","9","3","1","10.1109/OCIT53463.2021.00013","https://www.scopus.com/inward/record.uri?eid=2-s2.0-85127407153&doi=10.1109%2fOCIT53463.2021.00013&partnerID=40&md5=0c9082392b643737d921dee376f61c25","BML Munjal University, Gurugram, India; Banasthali Vidhyapith, Rajasthan, India; Silicon Institute of Technology, Bhubaneswar, India; NIT, Goa, India","Chauhan R., BML Munjal University, Gurugram, India; Bandopadhaya S., Banasthali Vidhyapith, Rajasthan, India; Dev M., BML Munjal University, Gurugram, India; Mishra A., Silicon Institute of Technology, Bhubaneswar, India; Giri L.I., NIT, Goa, India; Kharel B., Silicon Institute of Technology, Bhubaneswar, India; Samal S.R., BML Munjal University, Gurugram, India","Conference paper","Final","","Scopus","2-s2.0-85127407153"
"Bandopadhaya S.; Dey R.; Suhag A.","Bandopadhaya, Shuvabrata (55608418800); Dey, Rajiv (57192542474); Suhag, Ashok (54916937000)","55608418800; 57192542474; 54916937000","Integrated healthcare monitoring solutions for soldier using the internet of things with distributed computing","2020","Sustainable Computing: Informatics and Systems","26","","100378","","","","19","10.1016/j.suscom.2020.100378","https://www.scopus.com/inward/record.uri?eid=2-s2.0-85082598991&doi=10.1016%2fj.suscom.2020.100378&partnerID=40&md5=d826532c30624554a51070e463d98ff4","School of Engineering and Technology, BML Munjal University, Gurugram, India","Bandopadhaya S., School of Engineering and Technology, BML Munjal University, Gurugram, India; Dey R., School of Engineering and Technology, BML Munjal University, Gurugram, India; Suhag A., School of Engineering and Technology, BML Munjal University, Gurugram, India","Article","Final","","Scopus","2-s2.0-85082598991"
"Mandal A.K.; Cortesi A.; Sarkar A.; Chaki N.","Mandal, Amit Kr (55263686400); Cortesi, Agostino (57211052239); Sarkar, Anirban (57193313016); Chaki, Nabendu (6602146347)","55263686400; 57211052239; 57193313016; 6602146347","Things as a service: Service model for IoT","2019","IEEE International Conference on Industrial Informatics (INDIN)","2019-July","","8972241","1364","1369","5","3","10.1109/INDIN41052.2019.8972241","https://www.scopus.com/inward/record.uri?eid=2-s2.0-85079062842&doi=10.1109%2fINDIN41052.2019.8972241&partnerID=40&md5=376c8e9d71c01def004d99e68392f78e","Università Ca' Foscari Venezia, DAIS, Venice, Italy; Department of Computer Science and Engineering, BML Munjal University, Gurugram, India; National Institute of Technology, Department of Computer Science Engineering, Durgapur, India; University of Calcutta, Department of Computer Science and Engineering, Kolkata, India","Mandal A.K., Università Ca' Foscari Venezia, DAIS, Venice, Italy, Department of Computer Science and Engineering, BML Munjal University, Gurugram, India; Cortesi A., Università Ca' Foscari Venezia, DAIS, Venice, Italy; Sarkar A., National Institute of Technology, Department of Computer Science Engineering, Durgapur, India; Chaki N., University of Calcutta, Department of Computer Science and Engineering, Kolkata, India","Conference paper","Final","All Open Access; Green Open Access","Scopus","2-s2.0-85079062842"
"Roy A.; Chandra S.; Rabidas R.","Roy, Amarjit (57014006000); Chandra, Snehal (57223628879); Rabidas, Rinku (57191042577)","57014006000; 57223628879; 57191042577","Improved Switching Vector Median Filter for Removal of Impulse Noise from Color Images","2021","Lecture Notes in Electrical Engineering","721 LNEE","","","11","19","8","1","10.1007/978-981-15-9938-5_2","https://www.scopus.com/inward/record.uri?eid=2-s2.0-85105927072&doi=10.1007%2f978-981-15-9938-5_2&partnerID=40&md5=d00d737d74fd050be40ee78df115a27b","Depatment of Electronics and Communication, BML Munjal University, Gurgaon, Haryana, India; Depatment of Electronics and Communication, Assam University, Silchar, Assam, India","Roy A., Depatment of Electronics and Communication, BML Munjal University, Gurgaon, Haryana, India; Chandra S., Depatment of Electronics and Communication, BML Munjal University, Gurgaon, Haryana, India; Rabidas R., Depatment of Electronics and Communication, Assam University, Silchar, Assam, India","Conference paper","Final","","Scopus","2-s2.0-85105927072"
"Tandon H.; Chakraborty T.; Suhag V.","Tandon, Hiteshi (57210314363); Chakraborty, Tanmoy (56350222300); Suhag, Vandana (57210319105)","57210314363; 56350222300; 57210319105","On the validity of minimum magnetizability principle in chemical reactions","2021","Acta Chimica Slovenica","68","1","","178","184","6","6","10.17344/acsi.2020.6305","https://www.scopus.com/inward/record.uri?eid=2-s2.0-85098960434&doi=10.17344%2facsi.2020.6305&partnerID=40&md5=c09b96a038c3e240468a60a440d5cf4f","Department of Chemistry, Manipal University Jaipur, Jaipur, 303007, India; Department of Chemistry and Biochemistry, School of Basic Sciences and Research, Sharda University, Greater Noida, 201310, India; Department of Applied Sciences, BML Munjal University, Gurugram, 122413, India","Tandon H., Department of Chemistry, Manipal University Jaipur, Jaipur, 303007, India; Chakraborty T., Department of Chemistry and Biochemistry, School of Basic Sciences and Research, Sharda University, Greater Noida, 201310, India; Suhag V., Department of Applied Sciences, BML Munjal University, Gurugram, 122413, India","Article","Final","All Open Access; Gold Open Access","Scopus","2-s2.0-85098960434"
"Karwasra K.; Kumar D.; Soni G.; Prakash S.","Karwasra, Kritika (57218708385); Kumar, Devesh (57212687742); Soni, Gunjan (26423256300); Prakash, Surya (57212000728)","57218708385; 57212687742; 26423256300; 57212000728","Webometric study of lean manufacturing","2021","Lecture Notes in Mechanical Engineering","","","","309","322","13","2","10.1007/978-981-15-5519-0_23","https://www.scopus.com/inward/record.uri?eid=2-s2.0-85092132959&doi=10.1007%2f978-981-15-5519-0_23&partnerID=40&md5=fc2bb95ffdca881a695734c7ee43ff81","Mechanical Engineering, Malaviya National Institute of Technology, Jaipur, Rajasthan, India; BML Munjal University, Haryana, India","Karwasra K., Mechanical Engineering, Malaviya National Institute of Technology, Jaipur, Rajasthan, India; Kumar D., Mechanical Engineering, Malaviya National Institute of Technology, Jaipur, Rajasthan, India; Soni G., Mechanical Engineering, Malaviya National Institute of Technology, Jaipur, Rajasthan, India; Prakash S., BML Munjal University, Haryana, India","Conference paper","Final","","Scopus","2-s2.0-85092132959"
"Yousuf B.; Shukla A.; Arora M.K.; Bindal A.; Jasrotia A.S.","Yousuf, Bisma (57113508600); Shukla, Aparna (56844514100); Arora, Manoj K. (7103319791); Bindal, Ankit (57200288877); Jasrotia, Avtar S. (57190788833)","57113508600; 56844514100; 7103319791; 57200288877; 57190788833","On Drivers of Subpixel Classification Accuracy-An Example from Glacier Facies","2020","IEEE Journal of Selected Topics in Applied Earth Observations and Remote Sensing","13","","8968758","601","608","7","8","10.1109/JSTARS.2019.2955955","https://www.scopus.com/inward/record.uri?eid=2-s2.0-85081074259&doi=10.1109%2fJSTARS.2019.2955955&partnerID=40&md5=0f22e122c496e9b419db41c31bf46f59","University of Jammu, Jammu, 180006, India; Ministry of Earth Sciences, New Delhi, 110003, India; BML Munjal University, Gurgaon, 122413, India; Deutsche Bank, Pune, 411006, India","Yousuf B., University of Jammu, Jammu, 180006, India; Shukla A., Ministry of Earth Sciences, New Delhi, 110003, India; Arora M.K., BML Munjal University, Gurgaon, 122413, India; Bindal A., Deutsche Bank, Pune, 411006, India; Jasrotia A.S., University of Jammu, Jammu, 180006, India","Article","Final","All Open Access; Gold Open Access","Scopus","2-s2.0-85081074259"
"Chini M.K.; Purohit S.; Bheemaraju A.; Chakraborty T.; Singh K.P.; Ivaturi A.; Satapathi S.","Chini, Mrinmoy Kumar (57190120798); Purohit, Smruti (57217678071); Bheemaraju, Amarnath (54392380300); Chakraborty, Tanmoyendu (57217678380); Singh, Kishan Pal (57217683809); Ivaturi, Aruna (36131546300); Satapathi, Soumitra (36610769900)","57190120798; 57217678071; 54392380300; 57217678380; 57217683809; 36131546300; 36610769900","Carbon-Based Adsorbents from Naturally Available Bermuda Grasses: Removal of TDS and Arsenic Ions","2020","ChemistrySelect","5","25","","7571","7580","9","1","10.1002/slct.201902892","https://www.scopus.com/inward/record.uri?eid=2-s2.0-85087525038&doi=10.1002%2fslct.201902892&partnerID=40&md5=418e5b10bae8524f3cb8839569a0cadf","Department of Physics, Indian Institute of Technology Roorkee, Roorkee, 247667, Uttarakhand, India; BML Munjal University, Gurgaon, 122413, Haryana, India; Smart Materials Research and Device Technology (SMaRDT) Group, Department of Pure and Applied Chemistry, University of Strathclyde, Thomas Graham building, Glasgow, G1 1XL, United Kingdom","Chini M.K., Department of Physics, Indian Institute of Technology Roorkee, Roorkee, 247667, Uttarakhand, India; Purohit S., Department of Physics, Indian Institute of Technology Roorkee, Roorkee, 247667, Uttarakhand, India; Bheemaraju A., BML Munjal University, Gurgaon, 122413, Haryana, India; Chakraborty T., Department of Physics, Indian Institute of Technology Roorkee, Roorkee, 247667, Uttarakhand, India; Singh K.P., BML Munjal University, Gurgaon, 122413, Haryana, India; Ivaturi A., Smart Materials Research and Device Technology (SMaRDT) Group, Department of Pure and Applied Chemistry, University of Strathclyde, Thomas Graham building, Glasgow, G1 1XL, United Kingdom; Satapathi S., Department of Physics, Indian Institute of Technology Roorkee, Roorkee, 247667, Uttarakhand, India","Article","Final","All Open Access; Green Open Access","Scopus","2-s2.0-85087525038"
"Khatter K.","Khatter, Kiran (54787827500)","54787827500","Neutrosophic linear programming using possibilistic mean","2020","Soft Computing","24","22","","16847","16867","20","16","10.1007/s00500-020-04980-y","https://www.scopus.com/inward/record.uri?eid=2-s2.0-85087674687&doi=10.1007%2fs00500-020-04980-y&partnerID=40&md5=18219ecfcca32a8df58f078c15d8240b","Department of Computer Science, BML Munjal University, Sidhrawali, India","Khatter K., Department of Computer Science, BML Munjal University, Sidhrawali, India","Article","Final","","Scopus","2-s2.0-85087674687"
"Sharma S.; Singh K.; Kumar S.; Rana A.; Bhatt K.; Dwivedi Y.; Gupta M.; Tripathi C.C.","Sharma, Sandeep (57213924174); Singh, Karamvir (57212380583); Kumar, Sandeep (57218172626); Rana, Abhimanyu (36182549900); Bhatt, Kapil (56957888700); Dwivedi, Y. (7004249315); Gupta, Monish (57214001289); Tripathi, C.C. (36640260700)","57213924174; 57212380583; 57218172626; 36182549900; 56957888700; 7004249315; 57214001289; 36640260700","Optical and electrical investigations of rubbing assisted few-layer graphene thin film for feasibility of flexible electrode","2020","Optik","203","","163989","","","","3","10.1016/j.ijleo.2019.163989","https://www.scopus.com/inward/record.uri?eid=2-s2.0-85076553370&doi=10.1016%2fj.ijleo.2019.163989&partnerID=40&md5=7469ea5ca83323946c463abfe07d0649","University Institute of Engineering and Technology, Kurukshetra University, Kurukshetra, 136119, India; BML Munjal University, Gurugram, India; Physics Department, National Institute of Technology Kurukshetra, India","Sharma S., University Institute of Engineering and Technology, Kurukshetra University, Kurukshetra, 136119, India; Singh K., University Institute of Engineering and Technology, Kurukshetra University, Kurukshetra, 136119, India; Kumar S., University Institute of Engineering and Technology, Kurukshetra University, Kurukshetra, 136119, India; Rana A., BML Munjal University, Gurugram, India; Bhatt K., University Institute of Engineering and Technology, Kurukshetra University, Kurukshetra, 136119, India; Dwivedi Y., Physics Department, National Institute of Technology Kurukshetra, India; Gupta M., University Institute of Engineering and Technology, Kurukshetra University, Kurukshetra, 136119, India; Tripathi C.C., University Institute of Engineering and Technology, Kurukshetra University, Kurukshetra, 136119, India","Article","Final","","Scopus","2-s2.0-85076553370"
"Yadav M.; Choudhary S.","Yadav, Mohit (56857207800); Choudhary, Sangita (57205549996)","56857207800; 57205549996","Satisfaction from romantic relationship and social media usage: Mediating role of self-disclosure and CMC motives","2019","VINE Journal of Information and Knowledge Management Systems","49","4","","609","628","19","2","10.1108/VJIKMS-09-2018-0078","https://www.scopus.com/inward/record.uri?eid=2-s2.0-85073674483&doi=10.1108%2fVJIKMS-09-2018-0078&partnerID=40&md5=bb7488c3d2174cb329d064a9370037fb","Jindal Global Business School, O.P. Jindal Global University, Sonipat, India; School of Management, BML Munjal University, Gurgaon, India","Yadav M., Jindal Global Business School, O.P. Jindal Global University, Sonipat, India; Choudhary S., School of Management, BML Munjal University, Gurgaon, India","Article","Final","","Scopus","2-s2.0-85073674483"
"Vats P.; Soni G.; Rathore A.P.S.; Yadav S.P.","Vats, Peeyush (57203138839); Soni, Gunjan (26423256300); Rathore, Ajay Pal Singh (15763606900); Yadav, Surya Prakash (57209641312)","57203138839; 26423256300; 15763606900; 57209641312","A demand aggregation approach for inventory control in two echelon supply chain under uncertainty","2019","OPSEARCH","56","3","","840","868","28","3","10.1007/s12597-019-00389-w","https://www.scopus.com/inward/record.uri?eid=2-s2.0-85068329942&doi=10.1007%2fs12597-019-00389-w&partnerID=40&md5=3c3d18f6935ae8b44c39638ab26e8ed0","Malaviya National Institute of Technology, Jaipur, India; School of Engineering and Technology, BML Munjal University, Gurgaon, Haryana, India","Vats P., Malaviya National Institute of Technology, Jaipur, India; Soni G., Malaviya National Institute of Technology, Jaipur, India; Rathore A.P.S., Malaviya National Institute of Technology, Jaipur, India; Yadav S.P., School of Engineering and Technology, BML Munjal University, Gurgaon, Haryana, India","Article","Final","","Scopus","2-s2.0-85068329942"
"Chopra K.; Prasada Rao A.K.","Chopra, Kunal (57205465598); Prasada Rao, A.K. (56962715100)","57205465598; 56962715100","Ultrasonicated Direct Chill Clad Casting of Magnesium Alloy: A Computational Approach","2019","Transactions of the Indian Institute of Metals","72","12","","3027","3033","6","1","10.1007/s12666-019-01768-z","https://www.scopus.com/inward/record.uri?eid=2-s2.0-85068955914&doi=10.1007%2fs12666-019-01768-z&partnerID=40&md5=5563bf03c773e332fc3486d1258b8ffb","Department of Mechanical Engineering, SoET, BML Munjal University, Gurgaon, 122 413, India","Chopra K., Department of Mechanical Engineering, SoET, BML Munjal University, Gurgaon, 122 413, India; Prasada Rao A.K., Department of Mechanical Engineering, SoET, BML Munjal University, Gurgaon, 122 413, India","Article","Final","","Scopus","2-s2.0-85068955914"
