"Authors","Author full names","Author(s) ID","Title","Year","Source title","Volume","Issue","Art. No.","Page start","Page end","Page count","Cited by","DOI","Link","Affiliations","Authors with affiliations","Document Type","Publication Stage","Open Access","Source","EID"
"Husain A.; Nanda M.N.; Chowdary M.S.; Sajid M.","Husain, Akhlaq (56081150000); Nanda, Manikyala Navaneeth (57444186900); Chowdary, Movva Sitaram (57444380000); Sajid, Mohammad (56230453200)","56081150000; 57444186900; 57444380000; 56230453200","Fractals: An Eclectic Survey, Part-I","2022","Fractal and Fractional","6","2","89","","","","14","10.3390/fractalfract6020089","https://www.scopus.com/inward/record.uri?eid=2-s2.0-85124180850&doi=10.3390%2ffractalfract6020089&partnerID=40&md5=a069b2d3835ad770e0af6097dbdbad46","Department of Applied Sciences, BML Munjal University, Gurgaon, 122413, India; School of Engineering & Technology, BML Munjal University, Gurgaon, 122413, India; Department of Mechanical Engineering, College of Engineering, Qassim University, Buraidah, 51452, Saudi Arabia","Husain A., Department of Applied Sciences, BML Munjal University, Gurgaon, 122413, India; Nanda M.N., School of Engineering & Technology, BML Munjal University, Gurgaon, 122413, India; Chowdary M.S., School of Engineering & Technology, BML Munjal University, Gurgaon, 122413, India; Sajid M., Department of Mechanical Engineering, College of Engineering, Qassim University, Buraidah, 51452, Saudi Arabia","Review","Final","All Open Access; Gold Open Access","Scopus","2-s2.0-85124180850"
"Sahu S.; Sahu S.B.B.P.J.; Nayak S.; Mohapatra J.; Khuntia S.K.; Malla C.; Samal P.; Patra S.K.; Swain S.","Sahu, Sibakanta (58333509300); Sahu, Saipad B B P J (57638573200); Nayak, Subhakanta (57200370550); Mohapatra, Jagannath (57216201004); Khuntia, Sujit Kumar (57207858800); Malla, Chandrabhanu (57204048787); Samal, Priyaranjan (57204362766); Patra, Saroj Kumar (54396107000); Swain, Suchismita (57193698759)","58333509300; 57638573200; 57200370550; 57216201004; 57207858800; 57204048787; 57204362766; 54396107000; 57193698759","Characterization of natural fiber extracted from Bauhinia vahlii bast subjected to different surface treatments: A potential reinforcement in polymer composite","2023","Journal of Natural Fibers","20","1","2162185","","","","2","10.1080/15440478.2022.2162185","https://www.scopus.com/inward/record.uri?eid=2-s2.0-85145431954&doi=10.1080%2f15440478.2022.2162185&partnerID=40&md5=669718d1a4ed4289e31182bb65702527","Department of Mechanical Engineering, Gandhi Institute of Technological Advancement (GITA) Autonomous College, Bhubaneswar, India; Department of Mechanical Engineering, College of Engineering Bhubaneswar, Biju Patnaik University of Technology, Bhubaneswar, India; Department of Mechanical Engineering, Radhakrishna Institute of Technology and Engineering, Odisha, Bhubaneswar, India; Department of Mechanical Engineering, Koneru Lakshmaiah Education Foundation, Andra Pradesh, India; School of Engineering and Technology, BML Munjal University, Gurugram, India; Department of Operations and IT, ICFAI Business School, Hyderabad, India","Sahu S., Department of Mechanical Engineering, Gandhi Institute of Technological Advancement (GITA) Autonomous College, Bhubaneswar, India; Sahu S.B.B.P.J., Department of Mechanical Engineering, Gandhi Institute of Technological Advancement (GITA) Autonomous College, Bhubaneswar, India; Nayak S., Department of Mechanical Engineering, College of Engineering Bhubaneswar, Biju Patnaik University of Technology, Bhubaneswar, India; Mohapatra J., Department of Mechanical Engineering, College of Engineering Bhubaneswar, Biju Patnaik University of Technology, Bhubaneswar, India; Khuntia S.K., Department of Mechanical Engineering, College of Engineering Bhubaneswar, Biju Patnaik University of Technology, Bhubaneswar, India; Malla C., Department of Mechanical Engineering, Radhakrishna Institute of Technology and Engineering, Odisha, Bhubaneswar, India; Samal P., Department of Mechanical Engineering, Koneru Lakshmaiah Education Foundation, Andra Pradesh, India; Patra S.K., School of Engineering and Technology, BML Munjal University, Gurugram, India; Swain S., Department of Operations and IT, ICFAI Business School, Hyderabad, India","Article","Final","All Open Access; Gold Open Access","Scopus","2-s2.0-85145431954"
"Baloria V.; Yadav A.; Singh P.; Gupta G.","Baloria, Vishal (57567250400); Yadav, Aditya (57209138110); Singh, Preetam (56565913000); Gupta, Govind (57209792251)","57567250400; 57209138110; 56565913000; 57209792251","Semiconductor oxide based chemiresistive gas sensors","2023","Carbon Nanomaterials and their Nanocomposite-Based Chemiresistive Gas Sensors: Applications, Fabrication and Commercialization","","","","133","167","34","1","10.1016/B978-0-12-822837-1.00004-6","https://www.scopus.com/inward/record.uri?eid=2-s2.0-85158936835&doi=10.1016%2fB978-0-12-822837-1.00004-6&partnerID=40&md5=94bc32a3b09b95baa60211a26c322f71","Sensor Device and Metrology, CSIR-National Physical Laboratory (NPL), New Delhi, India; Centre for Advanced Materials and Devices, BML Munjal University, Haryana, Gurugram, India; Academy of Scientific and Innovative Research, CSIR-HRDC Campus, Uttar Pradesh, Ghaziabad, India","Baloria V., Sensor Device and Metrology, CSIR-National Physical Laboratory (NPL), New Delhi, India, Centre for Advanced Materials and Devices, BML Munjal University, Haryana, Gurugram, India; Yadav A., Sensor Device and Metrology, CSIR-National Physical Laboratory (NPL), New Delhi, India, Academy of Scientific and Innovative Research, CSIR-HRDC Campus, Uttar Pradesh, Ghaziabad, India; Singh P., Sensor Device and Metrology, CSIR-National Physical Laboratory (NPL), New Delhi, India, Academy of Scientific and Innovative Research, CSIR-HRDC Campus, Uttar Pradesh, Ghaziabad, India; Gupta G., Sensor Device and Metrology, CSIR-National Physical Laboratory (NPL), New Delhi, India, Academy of Scientific and Innovative Research, CSIR-HRDC Campus, Uttar Pradesh, Ghaziabad, India","Book chapter","Final","","Scopus","2-s2.0-85158936835"
"Ju Y.; Tu Y.; Zheng T.-X.; Liu L.; Pei Q.; Bhardwaj A.; Yu K.","Ju, Ying (57171472100); Tu, Yulong (57963371100); Zheng, Tong-Xing (55771505100); Liu, Lei (56612510500); Pei, Qingqi (15763462800); Bhardwaj, Arpit (49361153100); Yu, Keping (56316023300)","57171472100; 57963371100; 55771505100; 56612510500; 15763462800; 49361153100; 56316023300","Joint design of beamforming and trajectory for integrated sensing and communication drone networks","2022","DroneCom 2022 - Proceedings of the 5th International ACM Mobicom Workshop on Drone Assisted Wireless Communications for 5G and Beyond","","","","55","60","5","0","10.1145/3555661.3560864","https://www.scopus.com/inward/record.uri?eid=2-s2.0-85141864114&doi=10.1145%2f3555661.3560864&partnerID=40&md5=b56cacbdf28c8988df9e4a8fa3e7c65a","Xidian University, Xi'an, China; Xidian University, Guangzhou, China; Xi'an Jiaotong University, Xi'an, China; Southeast University, Nanjing, China; Bml Munjal University, Gurugram, India; Hosei University, Tokyo, Japan","Ju Y., Xidian University, Xi'an, China; Tu Y., Xidian University, Guangzhou, China; Zheng T.-X., Xi'an Jiaotong University, Xi'an, China, Southeast University, Nanjing, China; Liu L., Xidian University, Guangzhou, China; Pei Q., Xidian University, Xi'an, China; Bhardwaj A., Bml Munjal University, Gurugram, India; Yu K., Hosei University, Tokyo, Japan","Conference paper","Final","","Scopus","2-s2.0-85141864114"
"Ajefu J.; Uchenna E.; Singh N.; Ali S.Z.","Ajefu, Joseph (57196469000); Uchenna, Efobi (56231281900); Singh, Nadia (57193067210); Ali, Shayequa Zeenat (57363466200)","57196469000; 56231281900; 57193067210; 57363466200","Women’s Inheritance Rights and Child Health Outcomes in Kenya","2023","Journal of Family and Economic Issues","","","","","","","0","10.1007/s10834-023-09895-y","https://www.scopus.com/inward/record.uri?eid=2-s2.0-85151477562&doi=10.1007%2fs10834-023-09895-y&partnerID=40&md5=6361accac8a11476f88484265f56ed95","Newcastle Business School, Northumbria University, Newcastle Upon Tyne, United Kingdom; Centre for Social Development in Africa (CSDA), University of Johannesburg, Johannesburg, South Africa; Centre for Study of the Economies of Africa, Abuja, Nigeria; School of Law, BML Munjal University, Haryana, Kapriwas, India","Ajefu J., Newcastle Business School, Northumbria University, Newcastle Upon Tyne, United Kingdom, Centre for Social Development in Africa (CSDA), University of Johannesburg, Johannesburg, South Africa; Uchenna E., Centre for Study of the Economies of Africa, Abuja, Nigeria; Singh N., Newcastle Business School, Northumbria University, Newcastle Upon Tyne, United Kingdom; Ali S.Z., School of Law, BML Munjal University, Haryana, Kapriwas, India","Article","Article in press","All Open Access; Hybrid Gold Open Access","Scopus","2-s2.0-85151477562"
"Chakraborty S.; Shaikh S.H.; Chakrabarti A.; Ghosh R.","Chakraborty, Sanjay (57169636900); Shaikh, Soharab Hossain (36761579500); Chakrabarti, Amlan (24342850300); Ghosh, Ranjan (55844406900)","57169636900; 36761579500; 24342850300; 55844406900","Quantum image edge extraction based on classical robinson operator","2022","Multimedia Tools and Applications","81","23","","33459","33481","22","2","10.1007/s11042-022-12627-3","https://www.scopus.com/inward/record.uri?eid=2-s2.0-85128322986&doi=10.1007%2fs11042-022-12627-3&partnerID=40&md5=ac1a29b01e0a54459ccf587d5384cf11","Computer Science and Engineering, JIS University, Kolkata, India; Computer Science and Engineering, BML Munjal University, Kapriwas, India; A.K.Choudhury School of IT, University of Calcutta, Kolkata, India","Chakraborty S., Computer Science and Engineering, JIS University, Kolkata, India; Shaikh S.H., Computer Science and Engineering, BML Munjal University, Kapriwas, India; Chakrabarti A., A.K.Choudhury School of IT, University of Calcutta, Kolkata, India; Ghosh R., A.K.Choudhury School of IT, University of Calcutta, Kolkata, India","Article","Final","","Scopus","2-s2.0-85128322986"
"Mallidi R.K.; Sharma M.; Mallidi S.P.","Mallidi, Ravi Kiran (57254989800); Sharma, Manmohan (57209467880); Mallidi, Sai Prabhas (58178696900)","57254989800; 57209467880; 58178696900","Health Care Monitoring Application using IoT Devices","2022","Proceedings - 2022 4th International Conference on Advances in Computing, Communication Control and Networking, ICAC3N 2022","","","","2413","2417","4","0","10.1109/ICAC3N56670.2022.10074172","https://www.scopus.com/inward/record.uri?eid=2-s2.0-85152197787&doi=10.1109%2fICAC3N56670.2022.10074172&partnerID=40&md5=afe6d1fd222247c308ac7761232846da","Lovely Professional University, School of Computer Applications, Punjab, India; Bml Munjal University, School of Engineering, Haryana, India","Mallidi R.K., Lovely Professional University, School of Computer Applications, Punjab, India; Sharma M., Lovely Professional University, School of Computer Applications, Punjab, India; Mallidi S.P., Bml Munjal University, School of Engineering, Haryana, India","Conference paper","Final","","Scopus","2-s2.0-85152197787"
"Chakraborty S.; Mandal S.B.; Shaikh S.H.","Chakraborty, Sanjay (57169636900); Mandal, Sudhindu Bikash (37020750100); Shaikh, Soharab Hossain (36761579500)","57169636900; 37020750100; 36761579500","Quantum image processing: challenges and future research issues","2022","International Journal of Information Technology (Singapore)","14","1","","475","489","14","13","10.1007/s41870-018-0227-8","https://www.scopus.com/inward/record.uri?eid=2-s2.0-85095430264&doi=10.1007%2fs41870-018-0227-8&partnerID=40&md5=95846eaf26b8802403da3a0507c44be8","A.K. Choudhury School of Information Technology, University of Calcutta, Kolkata, India; Computer Science and Engineering, BML Munjal University, Gurugram, India","Chakraborty S., A.K. Choudhury School of Information Technology, University of Calcutta, Kolkata, India; Mandal S.B., A.K. Choudhury School of Information Technology, University of Calcutta, Kolkata, India; Shaikh S.H., Computer Science and Engineering, BML Munjal University, Gurugram, India","Article","Final","All Open Access; Green Open Access","Scopus","2-s2.0-85095430264"
"Nayak S.; Samal P.; Malla C.; Pradhan M.K.; Khuntia S.K.; Mohapatra J.; Jena P.K.; Patra S.K.; Nayak B.B.; Swain S.","Nayak, Subhakanta (57200370550); Samal, Priyaranjan (57204362766); Malla, Chandrabhanu (57204048787); Pradhan, Manoj Kumar (57201916717); Khuntia, Sujit Kumar (57207858800); Mohapatra, Jagannath (57216201004); Jena, Pradeep Kumar (57195068706); Patra, Saroj Kumar (54396107000); Nayak, Bijaya Bijeta (56352342500); Swain, Suchismita (57193698759)","57200370550; 57204362766; 57204048787; 57201916717; 57207858800; 57216201004; 57195068706; 54396107000; 56352342500; 57193698759","Enhancement of Mechanical, Thermal and Morphological Properties of Eleusine Indica Grass Fiber Reinforced Epoxy Composites","2023","Journal of Natural Fibers","20","1","2163029","","","","0","10.1080/15440478.2022.2163029","https://www.scopus.com/inward/record.uri?eid=2-s2.0-85146759512&doi=10.1080%2f15440478.2022.2163029&partnerID=40&md5=724e745a82607171776d8be30c950e3a","Department of Mechanical Engineering, College of Engineering Bhubaneswar, Biju Patnaik University of Technology, Bhubaneswar, India; Department of Mechanical Engineering, Koneru Lakshmaiah Education Foundation, Vaddeswaram, India; Department of Mechanical Engineering, Radhakrishna Institute of Technology and Engineering, Bhubaneswar, India; Department of Mechanical Engineering, GITA Autonomous College, Bhubaneswar, India; School of Engineering and Technology, BML Munjal University, Gurugram, India; School of Mechanical Engineering, KIIT Deemed to be University, Bhubaneswar, India; Department of Operations and IT, ICFAI Business School, Hyderabad, India","Nayak S., Department of Mechanical Engineering, College of Engineering Bhubaneswar, Biju Patnaik University of Technology, Bhubaneswar, India; Samal P., Department of Mechanical Engineering, Koneru Lakshmaiah Education Foundation, Vaddeswaram, India; Malla C., Department of Mechanical Engineering, Radhakrishna Institute of Technology and Engineering, Bhubaneswar, India; Pradhan M.K., Department of Mechanical Engineering, GITA Autonomous College, Bhubaneswar, India; Khuntia S.K., Department of Mechanical Engineering, College of Engineering Bhubaneswar, Biju Patnaik University of Technology, Bhubaneswar, India; Mohapatra J., Department of Mechanical Engineering, College of Engineering Bhubaneswar, Biju Patnaik University of Technology, Bhubaneswar, India; Jena P.K., Department of Mechanical Engineering, GITA Autonomous College, Bhubaneswar, India; Patra S.K., School of Engineering and Technology, BML Munjal University, Gurugram, India; Nayak B.B., School of Mechanical Engineering, KIIT Deemed to be University, Bhubaneswar, India; Swain S., Department of Operations and IT, ICFAI Business School, Hyderabad, India","Article","Final","All Open Access; Gold Open Access","Scopus","2-s2.0-85146759512"
"Upreti H.; Pandey A.K.; Uddin Z.; Kumar M.","Upreti, Himanshu (57193790155); Pandey, Alok Kumar (35463604600); Uddin, Ziya (50862185600); Kumar, Manoj (57908382100)","57193790155; 35463604600; 50862185600; 57908382100","Thermophoresis and Brownian motion effects on 3D flow of Casson nanofluid consisting microorganisms over a Riga plate using PSO: A numerical study","2022","Chinese Journal of Physics","78","","","234","270","36","39","10.1016/j.cjph.2022.06.019","https://www.scopus.com/inward/record.uri?eid=2-s2.0-85133943709&doi=10.1016%2fj.cjph.2022.06.019&partnerID=40&md5=6b5c2aa2ecaa2dcd7d258883765a53e7","Department of Allied Sciences, Graphic Era Hill University, Uttarakhand, Haldwani, India; Department of Mathematics, Graphic Era Deemed to be University, Uttarakhand, Dehradun, India; Department of Applied Sciences, SoET, BML Munjal University, Haryana, Gurgaon, India; Department of Mathematics, Statistics and Computer Science, G. B. Pant University of Agriculture and Technology, Uttarakhand, Pantnagar, India","Upreti H., Department of Allied Sciences, Graphic Era Hill University, Uttarakhand, Haldwani, India; Pandey A.K., Department of Mathematics, Graphic Era Deemed to be University, Uttarakhand, Dehradun, India; Uddin Z., Department of Applied Sciences, SoET, BML Munjal University, Haryana, Gurgaon, India; Kumar M., Department of Mathematics, Statistics and Computer Science, G. B. Pant University of Agriculture and Technology, Uttarakhand, Pantnagar, India","Article","Final","","Scopus","2-s2.0-85133943709"
"Kumar A.; Prakash S.; Srivastava A.K.; Kumar R.; Pathak V.K.","Kumar, Aawish (57226074719); Prakash, Surya (57226556562); Srivastava, Ashish Kumar (57210985454); Kumar, Rajesh (57226522348); Pathak, Vimal Kumar (57191861651)","57226074719; 57226556562; 57210985454; 57226522348; 57191861651","A Novel Modeling Approach for Dent Identification and Sizing for Oil and Gas Pipeline","2023","Lecture Notes in Mechanical Engineering","","","","457","469","12","0","10.1007/978-981-19-4208-2_33","https://www.scopus.com/inward/record.uri?eid=2-s2.0-85138013010&doi=10.1007%2f978-981-19-4208-2_33&partnerID=40&md5=1877c4f6a894be467c33e116c0450b56","Mechanical Engineering Department, BML Munjal University, Gurgaon, India; Mechanical Engineering Department, Manipal University Jaipur, Jaipur, India; Chitkara College of Applied Engineering, Chitkara University, Punjab, Rajpura, India","Kumar A., Mechanical Engineering Department, BML Munjal University, Gurgaon, India; Prakash S., Mechanical Engineering Department, BML Munjal University, Gurgaon, India; Srivastava A.K., Mechanical Engineering Department, Manipal University Jaipur, Jaipur, India; Kumar R., Chitkara College of Applied Engineering, Chitkara University, Punjab, Rajpura, India; Pathak V.K., Mechanical Engineering Department, Manipal University Jaipur, Jaipur, India","Conference paper","Final","","Scopus","2-s2.0-85138013010"
"Das Dawn D.; Khan A.; Shaikh S.H.; Pal R.K.","Das Dawn, Debapratim (56543808800); Khan, Abhinandan (37665182000); Shaikh, Soharab Hossain (36761579500); Pal, Rajat Kumar (7201402133)","56543808800; 37665182000; 36761579500; 7201402133","A 2-Tier Bengali Dataset for Evaluation of Hard and Soft Classification Approaches","2023","IETE Journal of Research","","","","","","","0","10.1080/03772063.2023.2173672","https://www.scopus.com/inward/record.uri?eid=2-s2.0-85148585377&doi=10.1080%2f03772063.2023.2173672&partnerID=40&md5=29aa02b0b9f6159d793719f4807038ec","Department of Computer Science and Engineering, University of Calcutta, Kolkata, India; Product Development and Diversification Division, ARP Engineering, Kolkata, India; Department of Computer Science and Engineering, BML Munjal University, Gurgaon, 122413, India","Das Dawn D., Department of Computer Science and Engineering, University of Calcutta, Kolkata, India; Khan A., Product Development and Diversification Division, ARP Engineering, Kolkata, India; Shaikh S.H., Department of Computer Science and Engineering, BML Munjal University, Gurgaon, 122413, India; Pal R.K., Department of Computer Science and Engineering, University of Calcutta, Kolkata, India","Article","Article in press","","Scopus","2-s2.0-85148585377"
"Turukmane A.V.; Alhebaishi N.; Alshareef A.M.; Mirza O.M.; Bhardwaj A.; Singh B.","Turukmane, Anil V. (55595737600); Alhebaishi, Nawaf (57192958341); Alshareef, Abdulrhman M. (55305472800); Mirza, Olfat M. (57195937469); Bhardwaj, Arpit (49361153100); Singh, Bharat (57214772297)","55595737600; 57192958341; 55305472800; 57195937469; 49361153100; 57214772297","Multispectral image analysis for monitoring by IoT based wireless communication using secure locations protocol and classification by deep learning techniques","2022","Optik","271","","170122","","","","1","10.1016/j.ijleo.2022.170122","https://www.scopus.com/inward/record.uri?eid=2-s2.0-85140996385&doi=10.1016%2fj.ijleo.2022.170122&partnerID=40&md5=750df919cf3fa992d53d3c3ea6692501","Department of Computer Science & Engineering, VIT-AP University, Amaravati, Vijaywada, India; Department of Information Systems, Faculty of Computing and Information Technology, King Abdulaziz University, Jeddah, Saudi Arabia; Department of Computer Science, College of Computers and Information Systems, Umm Al-Qura University, Makkah, Saudi Arabia; BML Munjal University, India; Mechanical Engineering, GLA University, Uttar Pradesh, Mathura, India","Turukmane A.V., Department of Computer Science & Engineering, VIT-AP University, Amaravati, Vijaywada, India; Alhebaishi N., Department of Information Systems, Faculty of Computing and Information Technology, King Abdulaziz University, Jeddah, Saudi Arabia; Alshareef A.M., Department of Information Systems, Faculty of Computing and Information Technology, King Abdulaziz University, Jeddah, Saudi Arabia; Mirza O.M., Department of Computer Science, College of Computers and Information Systems, Umm Al-Qura University, Makkah, Saudi Arabia; Bhardwaj A., BML Munjal University, India; Singh B., Mechanical Engineering, GLA University, Uttar Pradesh, Mathura, India","Article","Final","","Scopus","2-s2.0-85140996385"
"Aggarwal S.; Srinivas R.; Puppala H.; Magner J.","Aggarwal, Shubham (57211838783); Srinivas, Rallapalli (56715239200); Puppala, Harish (57189240188); Magner, Joe (7005668048)","57211838783; 56715239200; 57189240188; 7005668048","Integrated decision support for promoting crop rotation based sustainable agricultural management using geoinformatics and stochastic optimization","2022","Computers and Electronics in Agriculture","200","","107213","","","","1","10.1016/j.compag.2022.107213","https://www.scopus.com/inward/record.uri?eid=2-s2.0-85134581092&doi=10.1016%2fj.compag.2022.107213&partnerID=40&md5=0c7540b81f544de95e4cc07c5829878a","Department of Civil Engineering, Birla Institute of Technology and Science, Rajasthan, Pilani, India; School of Engineering and Technology, BML Munjal University, Haryana, India; Department of Bioproducts and Biosystems Engineering, University of Minnesota, United States","Aggarwal S., Department of Civil Engineering, Birla Institute of Technology and Science, Rajasthan, Pilani, India; Srinivas R., Department of Civil Engineering, Birla Institute of Technology and Science, Rajasthan, Pilani, India; Puppala H., School of Engineering and Technology, BML Munjal University, Haryana, India; Magner J., Department of Bioproducts and Biosystems Engineering, University of Minnesota, United States","Article","Final","","Scopus","2-s2.0-85134581092"
"Khurana P.; Ganesan G.; Kumar G.; Sharma K.","Khurana, Parul (57222276297); Ganesan, Geetha (57224952805); Kumar, Gulshan (56398590900); Sharma, Kiran (57192438995)","57222276297; 57224952805; 56398590900; 57192438995","A Comparative Analysis of Unified Informetrics with Scopus and Web of Science","2022","Journal of Scientometric Research","11","2","","146","154","8","2","10.5530/jscires.11.2.16","https://www.scopus.com/inward/record.uri?eid=2-s2.0-85139223238&doi=10.5530%2fjscires.11.2.16&partnerID=40&md5=74a381492047b492dcf2679d20ae52b1","School of Computer Applications, Lovely Professional University, Punjab, Phagwara, India; Advanced Computing Research Society, Porur, Chennai, India; School of Computer Science and Engineering, Lovely Professional University, Phagwara, Punjab, Jalandhar, India; School of Engineering and Technology, BML Munjal University, Sidhrawali, Haryana, Gurugram, India","Khurana P., School of Computer Applications, Lovely Professional University, Punjab, Phagwara, India; Ganesan G., Advanced Computing Research Society, Porur, Chennai, India; Kumar G., School of Computer Science and Engineering, Lovely Professional University, Phagwara, Punjab, Jalandhar, India; Sharma K., School of Engineering and Technology, BML Munjal University, Sidhrawali, Haryana, Gurugram, India","Article","Final","All Open Access; Hybrid Gold Open Access","Scopus","2-s2.0-85139223238"
"Swain S.; Patra S.K.","Swain, Suchismita (57193698759); Patra, Saroj Kumar (54396107000)","57193698759; 54396107000","Advancements in cooling techniques and its impact on machining: A review","2023","Materials Today: Proceedings","","","","","","","0","10.1016/j.matpr.2023.02.438","https://www.scopus.com/inward/record.uri?eid=2-s2.0-85150025292&doi=10.1016%2fj.matpr.2023.02.438&partnerID=40&md5=191bfc7944751719ad5952c34eea0dda","Department of Operations and IT, ICFAI Business School (IBS), IFHE University, Telangana, Hyderabad, 501203, India; School of Engineering and Technology, BML Munjal University, Haryana, Gurugram, 122413, India; GITA Autonomous College, Odisha, Bhubaneswar, 752054, India","Swain S., Department of Operations and IT, ICFAI Business School (IBS), IFHE University, Telangana, Hyderabad, 501203, India; Patra S.K., School of Engineering and Technology, BML Munjal University, Haryana, Gurugram, 122413, India, GITA Autonomous College, Odisha, Bhubaneswar, 752054, India","Article","Article in press","","Scopus","2-s2.0-85150025292"
